marka,sikayet_tarihi,sikayet_eden_kullanici,sikayet_baslik,sikayet_metni
Flormar,14.08.2020,Beyza R.,Flormar Sarı Oje Fiyasko,Flormar'dan aldığım sarı oje tırnaklarımı sapsarı yaptı. Ne denediysem geçmiyor. En azından nasıl geçeceğini söyleyin bana. Flormar gibi bir markadan hiç beklemeyeceğim bir durum gerçekten. Ojesiz gezemez oldum. Tırnaklarım o kadar sarı ki utanıyorum insanların görmesinden.
Flormar,14.08.2020,Burcu Ö.,Flormar'da Virüs Bahanesi,"Avcılar Marmara Cad üzerindeki Flormar mağazasından alışveriş yaptım. Outlet mağaza olduğu için indirim vardı. 5 adet oje aldım. Glitter shine oje reyonunda 8.99 TL ibaresi vardı. Ödemeyi yaptım fişime baktım 14.99 TL olduğunu gördüm. Ürünün fiyatını indirimli zannederek aldığımı ve iade yapmak istediğimi belirttim. Fakat kasadan geçtikten sonra iade yapılmadığı söylendi, bizim sağlığımız içinmiş. Satın aldıktan birkaç dakika sonra iade edilmediğine ilk kez şahit oluyorum. Eve götürdüğüm bir ürün değil bu mağazada indirim varmış gibi lanse edilen bir ürün! Bunun virüsle ilgisi yok, herkes dokunduğu ürünü satın almıyor! Bu mağazadan şikayetçiyim! Ürünün iadesinin yapılmasını ve mağduriyetimin giderilmesini talep ediyorum!"
Flormar,14.08.2020,Büşra Y.,Flormar Dipliner Kutusu Devamlı Kırılıyor,"Merhaba, 
Flormar'ın dipliner ürününü yaklaşık 10 senedir kullanıyorum. Ancak son 1 aydır 2 tane dipliner evde kullanırken yanlışlıkla yere düştüğünde anında kutusu çatladı ve içerisindeki tüm sıvı yere dökülerek kullanılamaz hale geldi. Çok memnun kaldığım bir ürün ancak sırf bu son zamanlarda ki kutu sorunu yüzünden bir daha almamayı düşünüyorum. 
Kutu kalitesinin düşürüldüğünü düşünüyorum. 
Yetkililerin acilen bu soruna bir çözüm bulması gerekli."
Flormar,13.08.2020,Özgül E.,Flormar Kasada Personel Saygısızlığı,Markantalya AVM şubenize alışveriş yapmak için saat 16:00 civarında mağazanıza girdim. Bir maskara ve waterproof göz kalemi reyondan alıp kasaya geçtim. Personeliniz ürünleri okuttu fiyat yüksek çıkınca sordum göz kalemi neden 24 TL rafta 12 TL yazıyor dedim. Bana kendisi hayır firma etiketleri birleşik gönderiyor ayıramıyoruz dedi. 12 TL olan kalem üst rafta 24 TL olan kalem alt rafta sonuçta benim alacağım kalemin önünde 12 TL yazıyordu. Ben böyle olmaması gerektiğini söyledim personeliniz sert tepki vererek o zaman ürünü çıkartıyorum dedi. Bende alacağım iki ürünü de kasada bırakıp çıktım ve hala arkamdan söyleniyordu. Mağazanız için hiç hoş bir durum değil.
Flormar,12.08.2020,Melis Ş.,Flormar Kampanya Ürünü Gönderilmedi,"Flormar'ın uygulamasından yaklaşık 130 TL lik bir alışveriş yaptım. Benim alışveriş yaptığım sırada 99 TL ve üzerine "" color Palette eyeshadow "" paletini hediye ediyorlardı. Benim ne sepetime otomatik olarak eklendi ne de kargo ile birlikte geldi. Paleti gönderirseniz sevinirim. Teşekkürler"
Flormar,27.06.2020,Elif Ö.,Flormar Ürün İadesi Hakkında,17 mayısta Flormar'ın sitesinden almış olduğum ürünler Yurtiçi Kargo takip kodu ile bir aydan daha uzun bir sürede elime ulaşmayınca müşteri hizmetlerini aradım. Onlarda bana MNG Kargo'ya verildiğini ancak MNG Kargo'nun ürünleri Flormar'a iade ettiğini söyledi. Ürünlerin eğer bir hafta gibi bir sürede elime ulaşacaksa iade etmeyeceğimi söyledim. Onlarda mümkün olmadığını iade ettiklerini söyledi. Ancak 10 gün geçmesine rağmen tarafıma ne bilgilendirme ne de para iadesi yapıldı. Flormar gibi bir firmanın bu kadar ilgisiz olmasına ve defalarca aramama rağmen beni oyalamalarına diyecek bir şey bulamıyorum.
Flormar,03.08.2020,Duygu E.,Flormar Full Color Nail Enamel FC23 Petite Mint Yeşili Ojesi,Ojeyi çıkarttığımda tırnaklarım sapsarı oldu. Sarı renk hiçbir şekilde gitmiyor ki tırnaklarıma çok özen gösteririm. 3 gündür geçmiyor. O kadar sarı ki sanki kalemle boyamış gibi nasıl gidecek hiç bilmiyorum. Tırnaklarım çok kötü durumda. Yılların markası Flormar'ın bu şekilde ojeler üretmesi beni çok üzdü. Elimdeki bütün Flormar'ları çöpe atacağım. İnsan sağlığı sonuçta.
Flormar,28.07.2020,Btceyl,Flormar İade Reddi Olması,Birkaç gün önce Trendyol aracılığıyla almış olduğum fondöten kargodan gelince hemen açtım paramparça özentisiz paketlenmiş ve kırılmış bende hemen iade ettim ve iadem reddedilmiş. Bu nasıl bir haksızlık ben şikayetçiyim benim hatam değil ki iadem reddedilmiş kim yaptıysa o basit paketlemeyi telafi edilsin ben para verip alıyorum.
Flormar,22.07.2020,Hira U.,Flormar Sarı Oje Leke Bırakıyor,"Flormar sarı full color FC20 kodlu oje bayılarak aldığım bir üründü lakin hiç aklıma gelmezdi sapsarı çirkin bir görüntüyü tırnağımda bırakacağı. Diğer renklerinde hiçbir sorun yaşamamama rağmen bu ürün tam bir fiyasko. 

Tırnağımdan biri haftadır o sarı rengi çıkmadı ne yaptıysam olmadı hala o ojenin satışta olmasını Flormar ailesine hiç yakıştıramadım. Lütfen ama lütfen bir çözüm bulunsun. Güzelim tırnaklarım ne hale geldi."
Flormar,13.07.2020,Elif C.,Flormar Fondöten Oksitlenip Kusuyor,Ben 2 gün önce Flormar markasına gidip fondöten almak istediğimi söyledim ve cildimin nasıl bir yapısı olduğunu da söyledim. Fakat hiçbir ürünü beğenmedim gereksiz para verdim. Pandemiden dolayı denetmediler de. Ben aldım bunu diğer gün sabah yüzüme sürdüm her şeyi ile birlikte otobüse bindikten sonra yüzüme baktım nasıl duruyor diye. Tek kelime ile çok kötü. Yüzümde ne fondöten kalmış. Bir o kadar da çirkin gözüktüm bu marka yüzünden. Lütfen ürünü satmak için satmayın! Bir daha buradan hiçbir şey almayacağım.
Flormar,27.07.2020,Sibel V.,Flormar Mağaza Sorumlusunun Saygısızlığı!,"18 Mart tarihinde Giresun Gazi Caddesi Flormar mağazasından alışveriş yaptım. 8 adet oje aldım ve eve gittiğimde birkaç renginin bende var olduğunu fark edip bir sonraki gün farklı renkleriyle değiştirmek istedim 100 TL'lik alışverişe hediye olarak da Fondöten almıştım fakat içeri girdiğimde mağazanın sorumlusu olan bir bayan vardı değişim talebime değişim yapamam kalem ve ojelerde değişim olmuyor gibi sert bir tepkiyle karşıladı ama hediye ürünlerde değişim olmadığı prosedürünü kendisi bile bilmiyor ve değiştirdi daha sonradan yanlış işlem uygulandığının ve ürünün kasadan düşmediğini geri getirmem gerektiğini söylediler üstelik fişim olduğu halde. Akşam aldığım üzerinden 24 saat bile geçmeyen ürünlerimde renk değişimi yapmayıp alışverişi yaptığım arkadaşımı arayıp beni şikayet eder gibi bir üslup kullanması üstüne bir de sen beni anlamıyor musun git kime şikayet edersen et al ürünlerini iade edeyim o zaman bak beni sinirlendiriyorsun gibi kelimeler kullandı, bunlar mağaza sorumlusu birine yakışmıyor. Ayrıca fişimi fondöten değişiminden sonra tekrar geri istediğimde vermeyip bölge müdürü L**beyi aradı kendisiyle ben görüşmek istedim telefonu vermedi fişin fotokopisini çektirip ver demiş onu bile kendim yaptım düşünsenize o kişi ben değil de bir başkası olsa 9 10 parçalık alışveriş yapıp tek parçasını değiştirip başka bir gün başka bir ürünü değişime geldiğinde değiştiremiyor fişi geri vermiyorlar. İlk problemim de bu yüzden olmuştu Mart ayında yüzde 40 indiriminde mağaza yoğundu değişim yapmak istediğimde ürünü verip sen bunu al biz değişimini yapalım yarın fişini alırsın demişti ve bir sonraki gün gittiğimde değişimi yapıp fişi attığını söylediler. Başka mağazada değiştiririm dediğimde sıkıntı olur al ürünü vereyim arkadaştan keserim ücretini demişti ve almayıp sinirlenip çıkıp gitmiştim. Şimdi bunu söylediğimde yalan konuşuyorsun sen ben öyle bir şey söylemedim arkadaşınla arandaki mesele dedi bana üslubunu hareketlerini mimiklerini kısacası müşteriyle olan diyaloğunu beğenmiyorum. Diğer mağazalar bu değişimleri yapıyorsa burada da yapılması gerekiyor oralar market tarzı yerler biz kurumsalız dedi bende kurumsal bir mağazada çalışıyorum müşteri memnuniyeti ilk sırada gelmesi gerekiyor değişim yapılmıyorsa bile müşteri memnun ayrılsın diye istisna durumların olması gerekiyor bir daha zaten o mağazadan alışveriş yapmam o bayan olduğu sürece. Zaten bu durumun çözülmesini ve değişimimin yapılmasını istiyorum."
Flormar,16.07.2020,Zeliha U.,Flormar Water Proof Eye Liner Kötü Bir Ürün,Eve Altınoluk Balıkesir mağazadan sudan etkilenmeyen eye liner istedim görevli bayan Flormar önerdi ertesi gün kullanıp toplantıya gittim mahcup oldum gözlerim akmış bırakın sudan etkilenmesini 1 saat dayanmadı firmaya güveniyordum geçen aldığım kaş kalemi de kötü çıkınca şikayet etmek istiyorum ürün kalitesi bozulmuş.
Flormar,11.07.2020,Serenay A.,Flormar Sipariş Verdiğim Halde Kargo Bulunamadı,Flormar on mobil uygulamasından yaptığım alışverişte sipariş takipte ürünlerinin kargoya verildiği yazıyor fakat Yurtiçi Kargo takipte kargo bulunamadı yazıyor. Kargo mu takip edemiyorum. Gereğinin yapılmasını arz ederim.
Flormar,02.07.2020,Türkan A.,Flormar'da Siparişim Geri Gitti,"16.06.2020 tarihinde Flormar indiriminden verdiğim siparişlerim 10 gün olduğu halde adresime ulaşmadı. Yurtiçi Kargo tarafından. Hesabıma girip baktığımda kargoya verildi olarak gözüküyor. 

Yurtiçi Kargo siparişimin geri gittiğini söyledi adresi bulamadıkları için ama hiçbir şekilde bildirilmedi. Flormar hesabımda para iadesine dair bir şey yazmıyor."
Flormar,26.06.2020,Petek K.,Flormar Kargomu Teslim Aldım Ama Ürün Yok. Boş Kutu Geldi.,18.06.2020 tarihinde Trendyol'dan Flormar'ın maskarasını sipariş vermiştim. Bugün kargom geldi ama paketi açtığımda kutunun içi boş çıktı sipariş verdiğim ürün yoktu. Trendyol da flormarda sıradan firmalar değil böyle bir şey kabul edilemez sorunumun çözülmesini istiyorum en kısa zamanda...
Flormar,13.06.2020,Begüm Ç.,Flormar Ürünüm Hala Gelmedi,Ürünüm 2hafta geçti hala elime ulaşmadı hala ürün hazırlanıyor yazıyor ürünüm ne zaman gelir? Bilseydim mağazalardan alırdım. Diğer arkadaşlarımın ürünü 1haftada ulaştı ben 2haftadır hala ulaşamıyorum o kadar para harcıyoruz. Lütfen geri dönüş yap Flormar...
Flormar,29.05.2020,Zeynep D.,Flormar'dan Gelen Makyaj Bazının Pompasının Çubuğu Yok,Bir iki hafta önce Flormar internet sitesinden sipariş verdim. 7-8 parça sipariş verdim makyaj bazında aldım. Yalnız pompa kısmında çubuğu yok. Kontrol yapılmıyor galiba evet uygun fiyatlı olabilir ama çöp değil tabi ki. Neden böyle oluyor görselleri ekledim çözüm istiyorum lütfen.
Flormar,28.05.2020,Nur Şimal U.,Flormar Siparişimi Günlerdir Geçersiz Kargo Numarasıyla Bekletiyor,"16 Mayıs tarihinde vermiş olduğum siparişim hala geçersiz bir kargo numarasıyla sistemde bekletiliyor. Günlerdir müşteri hizmetlerine ulaşmak mümkün değil, hiçbir şekilde dönüş yapmıyorlar resmen paramızla mağdur oluyoruz. Ek olarak madem bunu kaldıramayacak bir kargo ağınız var, farklı firmaların da yaptığı gibi farklı kargolarla senkronize bir şekilde çalışmak zorundasınız müşteri olarak bu operasyon sorununun sorumlusu ben değilim. Sizin dışınızda aynı tarihte alışveriş yaptığım tüm firmalar siparişimi ulaştırdı, 1-2 gün beklemeyi anlarım ama günlerdir bu nasıl bir kotadır da bir türlü sıra gelmiyor. Pandemi döneminde sınıfta kalmış, indirim sürecini de yönetememiş bir firmadır Flormar. Sipariş verecekler 1-1.5 ayı gözde çıkarak vermeli."
Flormar,27.05.2020,Öznur B.,Flormar Siparişim 10 Gün Oldu Elime Ulaşmadı. Kargo Takip No... Geçersiz Uyarısı,15.05.2020 tarihinde vermiş olduğum kargom hala elime ulaşmadı. Kargoya verildi yazıyor ama kargo takip numarama hatalı deyip kayıt bulunamadı diyor. Birçok kişinin aynı konudan sıkıntı yaşadığını görüyorum bu sorunun bir an önce çözülmesini ve kargomun elime ulaşmasını istiyorum beni bu konuda bilgilendirseniz çok memnun olurum...
Flormar,27.04.2020,Merve A.,Flormar Kargo Hata Sorunu,16.05.2020 tarihinde vermiş olduğum kargom hala elime ulaşmadı. Kargoya verildi yazıyor ama kargo takip numarama hatalı deyip kayıt bulunamadı diyor. Birçok kişinin aynı konudan sıkıntı yaşadığını görüyorum bu sorunun bir an önce çözülmesini ve kargomun elime ulaşmasını istiyorum beni bu konuda bilgilendirseniz çok memnun olurum...
Flormar,18.04.2020,Kader,Flormar Kişisel Bilgiler Alındı,"Flormar kişisel bilgilerimi açığa çıkardı telefonumu arayan arayana böyle sorumsuz firma görmedim derhal silinsin üyeliğim yoksa gerekli işlemleri başlatacağım.  Müşteri hizmetlerini aradım üyeliğimi sileceklerini söylediler fakat hala silinmedi hala yabancı kişiler arayabiliyorlar beni.

"
Danone,26.07.2020,Celal ,"Danone Tikveşli Tebrikler Kazandınız,tarihi Geçmiş!","26.07.2020 Danette puding aldık. İc kapakta kazandınız diyor ama 31.05.2020 kampanya bittiğinde yazıyor. İyide yaklaşık 2 ay gibi bir sure geçmiş urunu neden toplatmazsınız piyasadan ve üründe ürerim tarihide bulunmuyor...

 yani bu olay suna benziyor şirket reklam yapıyor 1.000.000 ürün kampanyalı diye satışa çıkartıldığı söyleniyor ancak piyasaya 1.000 adet sürülüp kampanya tarihi bitince de 999.000 adet kampanya suresi dolmuş ürün sürülerek kazanılan pudingler hiç ediliyor. 

kampanya suresi dolan ürünlerinizi piyasadan çekiniz o zaman  haksızlık yapmayın."
Danone,26.07.2020,İpek,Danone Tikveşli İçinden Çıkan Böcek Görünümlü Siyah Partikül,Bodrum'daki bir Şok marketten 5 adet x2 probiyotik  almıştım. Sonraki gün içmek için dolaptan çıkardığımızda ailecek fark ettik ki 3 tanesinde siyah siyah böceği andıran tanecikler vardı. Yıllardır envai çeşit ürününüzü alırım ilk defa bununla karşılaştım. Bundan 15 gün önce  ilk alışımda da birkaç siyah şey fark etmiştim ve internetten araştırdığımda da gördüm ki bir sürü insan bu durumdan muzdarip. Ayrıca birini kaseye döktüğümde kesik kesik olduğunu ve tamamen karışmadığını fark ettim halbuki iyice çalkalanmış Çocuklarıma artık bu ürünlerden tüketmeyi yasaklayacağım. Lütfen bir açıklama yapınız.
Danone,21.07.2020,Büşra,Danone Tikveşli Kakaolu Puding Memnuniyetsizliği!,Bugün bakkaldan 3 tane puding aldık kızım birini yedi bir daha istedi açtığımızda sok olduk içinde acayip bir şey vardı böyle bir şey nasıl olabilir böyle çocukların yediği bir şey de bir daha asla almayacağım ve gerekli yerlere ileteceğim çocukların sağlığıyla oynuyorsunuz bangır bangır reklam yapan bir firma.
Danone,14.07.2020,Yavuz,Bozulmuş Danone Pro Plus,"Merhaba, 

13 Temmuz 2020 tarihinde A101 marketinden aldığım Danone Pro+, son kullanma tarihi 30.11.2020 olmasına karşın ekşimiş ve lapa haline gelerek bozulmuş. Tadını ise belirtmeye gerek yok sanırım.
Ürünü dökmedim ve atmadım. Talep ederse Danone, gelip urunu alarak test edebilir."
Danone,14.07.2020,Nilay ,Danone Tikveşli Danone Kakaolu Süt Üzerinde SKT Bulunmaması,Ürünlerinizi çok uzun yıllardır kullanmaktayım. Zamanında Lüleburgaz tesisinizi de gezme şansım olmuştu. Çocuğum içinde ürünlerinizi tercih ediyordum. O kadar güveni yormuşum ki ürünlerinize markette üzerinde ki SKT kontrolü bile yapmayı gerekli görmemişim. Dün Tekirdağ kapaklı organize şubenizde ki Migros mağazasından aldığım kakaolu sütler SKT basılmamış seri/ parti no basılmamış. Bende bir sağlık firmasında çalışıyorum. Bu kabul edilebilir bir hata değil. Hele ki çocuklarımızın tükettiği süt ürünleri yapıyorsunuz. 
Danone,13.07.2020,Arzu,Danone Tikveşli Krema Skt Geçmemiş Olmasına Rağmen Bozuk Çıktı,"Tikveşli krema son kullanma tarihi 2020 12. Ay olmasına rağmen donmuş bozuk çıktı. Kutuyu açınca şok oldum. Zaten yeterince pahalı, üstüne bir de bozuk çıktı. Nasıl böyle bir şey olabiliyor?! Tam yemeği bütün malzemeleri hazırlamış pişirmiş en son kremayı dökecek iken açınca bütün yemeğim de kaldı. Her şey cop oldu. Üstüne yemeksiz kaldım. Kutuyu üç kısmından açıp tencereye dökerken o bozulmuş su içine döküldü. Dedim bu ne kutuyu bir açtım tamamen baktım bozukmuş meğer!"
Danone,06.07.2020,Merve ,Danone Tikveşli Danone Meyveli Yoğurtta Küf Çıktı,Tarihi geçmemiş olmasına rağmen küf çıktı çocuklar için üretilen çıtırdat adlı meyveli (çilekli) yoğurtta küf çıktı. Sonuna geldiğinde fark ettik çocukların sağlığıyla oynayan bu marka. müşteri hizmetlerine de ulaşamadım eşim bugün almış ve tarihi de geçmemiş.
Danone,23.06.2020,Fikriye,Danone Tikveşli Yarısının Olmama Sorunu,Bugün Bim marketten çilekli mix Danone aldım açtım yarısı yok. Diğer yarısı nerede koca paket içi bomboş. Paramıza yazık gerçekten kül hakkına giriliyor. Aradım şikayet için ileteceğiz dediler saçmalık.
Danone,22.06.2020,Emre,Activia Probiyotik İçerisinden Çıkan Yabancı Madde,Her hafta düzenli olarak alışverişlerimizin vazgeçilmezi Activia incir ceviz olan 4lü paketten aldık. Yerken ağzımıza kum gibi bir şey geldi ve iğrendik neredeyse. Sağlığımız açısından iyi beslenelim derken düştüğümüz hale bak. İçindeki resmen kumdu şikayete dönüş sağlandığında illaki bir açıklamaları olacak fakat çözüme ulaşılacağını sanmıyorum.
Danone,20.06.2020,Hale,Danone Tikveşli Puding Buzdolabında Küflendi,Aldığımız günden beri buzdolabında sakladığımız Danone puding son kullanma tarihi dolmadan küflendi!
Danone,12.06.2020,Nihal,Danone Tikveşli Hatalı Ürün,Çocuğum için aldığım yoğurttan kıl benzeri ürün çıktı markanıza yakıştıramıyorum. Böyle bir hata nasıl olabilir? Devamlı olarak güven duyarak aldığım bir üründü. Artık alamayacağım nasıl olabilir ambalajlı bir üründen nasıl böyle bir şey çıkabilir inanamıyorum ürünün ivedi olarak incelenmesini rica ederim resim ektedir.
Danone,24.05.2020,Natalia,Danone Tikveşli Ürününüz Küflü Çıktı,Ben çocuklarıma Uzun süreden beri Danone danissimo başta olmak üzere sizin ürünlerinizden alıp yediriyorum. Ancak son aldığım ürünleriniz maalesef son kullanma tarihini henüz olmamasına rağmen ve ambalaj kapağının açılmamasına rağmen fotoğrafta da görüldüğü üzere ürünleriniz küflü çıktı. Ürünlerinize satın aldığım yer Ümraniye de A101 ve Orta park Migros. Ancak küflü Ürününüzü aldığımız yer Ümraniye inkılap Saray Mahallesi deki A101 mağazasıdır. Maalesef çocuklar sevdikleri ürünü küflü görünce çok üzüldüler bilemiyorum bundan sonra yeni ürün urunu alsam yerler ve gerçekten bilemiyorum. Çocukları bu tur sut ürünlerinden uzaklaşmalarını istemiyorum ancak özellikle dokuz yaşındaki oğlum oldukça hassas ve titiz bir çocuk. Sizden ricamız beklentimiz müşteri hizmetlerinizin veya yetkili bir kişinin çocuğumuzu arayarak bir daha benzer aksaklıklara neden olmayacağına dair ve kontrollerin titizlikle yapılacağına dair aşağıdaki telefonda arayarak güvence vermesidir. Böylece oğlum sizlerin ürünleri kontrol edeceğini bilirse güvenirse yemeye devam edebilir.
Danone,23.05.2020,Emrah,Danone Tikveşli'den Dannette Bozuk Puding,Dannette muzlu puding aldık STT 12.06.2020 olmasına rağmen puding bozuk çıktı. Büyük bir firmanın güvenle yediğimiz ürünlerinde bu denli bir olay olması çok üzücü. Bir durum oldu belki sorun üründen ya da soğuk zincir kaynaklı ama bunun takibini ve tüketiciye ulaşmasındaki sorumluluğu firmada olmasını düşünüyorum.
Danone,13.05.2020,Gülay,Danone Tikveşli Aldığım Milkshake Ambalajı Açık,"Marketten aldım eve geldim bu riskli dönemde her şeyi lavaboda yıkıyorum. Kapağını bir açtım yıkayayım diye ambalajı açık ve akmış, kurumuş şok oldum. Böyle bir dönemde her şeye dikkat etmelisiniz. Bir daha mı, asla almam. Böyle bir hata nasıl olur, sonuçta çocuğuma içirecektim."
Danone,16.05.2020,Güngör,Danone Tikveşli'de  Meyveli Yoğurttan Meyve Kurdu Çıktı,"2 gün önce A101 marketten aldığım 4 lü set halinde satılan Danone Activia kayısılı meyveli yoğurdun içinden meyve kurdu çıktı, ne bu markayı ne de başka bir markayı almamanızı tavsiye ederim, güvenim kalmadı benim, umarım daha önceden gözden kaçırıp ta yememişimdir."
Danone,10.05.2020,Osman,"Danone Tikveşli Ürünü Bulamıyorum!
",Danone danissimo limonlu cheesecake yoğurt yok marketler ve internet üzerinde yaptığım aramada ürünü bulamadım çocuğum için alacağım ama yok. Diğer danisimo modellerine baktım onlar da bulunmuyor limonlu olan lazım bir şekilde bulmam gerek.
Danone,14.04.2020,Nur,Danone Tikveşli Çocuk Sağlığı İhmali!,Çok severek ürünlerini kullandığımız Danone firmasının bu denli ihmalkâr olması ailemizi çok üzdü karşı maketten çocuğum için aldığım hüper yoğurt ve milkshake ürünlerinizin tarihi geçmiş ve küflenmişti ve ben bunu fark etmeden çocuğuma içirdim  market yetkilisine söylediğimizde onunla bir alakası olmadığını takibini ürünü getiren firmanın yaptığını söyledi ve biz market görevlisiyle birlikte ürünü getiren firmayı aradık telefona çıkan kişi çok sert bir tavırla (ne yapabilirim yarin gelip ürünleri değiştiririm) dedi ve telefona çıkan kişi dün gelip yeni ürün getirmiş ve tarihi geçmiş ürünleri almadan bırakmış market yetkilisi sürekli uyardığını söyledi. Biz bu durumu ilk defa yaşamadık daha önce de yaşamıştık fakat bu kez söz konuşu çocuğumuz ve bu ihmal affedilemez bu konu hakkında gerekli yerlere başvuruları yapacağız insan sağlığı bu kadar ucuz olmamalı  hele ki şu zor günlerde 2 yaşında  bir bebeğin   bağışıklık sistemiyle böyle oynayamazsınız. Biz gereğini yapacağız sizin de gereğini yapmanızı arz ederiz.
Danone,13.04.2020,Songül,Danone Tikveşli Fiyatının Bir Anda Gereksiz Bir Şekilde Artması!,Aşırı derecede zam yapmışsınız 7.5 TL ken 9. 5 TL yapmışsınız. Her yerde uygun ama sizde fiyatı farklı. Lütfen biraz mantıklı olun. Diğer bazı ürünlerde de aynı şeyi yapıyorsunuz rica ediyorum insaflı olun ve fiyatları düşürün. Evet temiz ürünler yani bilinmiş markalar satıyorsunuz. Niye daha pahalıya satıyorsunuz günah gerçekten. Yazık reçellerde de aynısını yapıyorsunuz.
Danone,03.04.2020,İbrahim ,Danone Puding Gramajı Düşürmüş!,Yıllarca çocuklarımıza danette’yi güvenle yedirdik. Markaya ve firmaya güvenimiz tamdı. Şu sıkıntılı süreçte Eve kapandığımız günlerde bu güvenli firmanın danette marka pudinglerinden aldık. Kapağını açtığımızda içinde puding bulamadık. Kutunun altı içe oval zaten yarısından az var. Ovallik de gizleme amaçlı belli ki. Bir tatlı kasığı puding çıktı resmini de yolluyorum size hiç yakışmadı. Gramajını düşürüp kutusunu büyütüp içini oval yapıp halkı kandırmayın. Kalitenizi düşürmeyin. Koyun pudingi içine alın parasını biz parasına itiraz etmiyoruz
Danone,03.04.2020,Pelin,Danone Tikveşli Tarihi Geçmemiş Ama Ekşi Çıktılar,Bebeğime aldığım danino bebe bisküvili yoğurtlar eksi çıktı. Son kullanma tarihlerine daha 10 gün var. Buna güvenerek tadına bakmadan yedirdim oğluma. Sonuncusunu bugün eşim yedi ve eksi olduğunu söyledi. Allah'a şükür oğluma bir şey olmadı. Ama bütün güvenim bitti şu an. Her gün yedirdiğim bir üründü.
Danone,02.04.2020,Kevser,Danone Tikveşli Danone Muzlu Puding Dibi Küflü Çıktı,Sürekli oğluma aldığım Danone muzlu puding bu kez küflü ve pütür pütür çıktı son kullanma tarihi geçmemiş ama neden böyle çıktı anlamadım çocukların tükettiği bir ürün dikkat edilmesi lazım biz görmesek öyle yese ne olacaktı. Aldığım yerde dolaptaydı evde de dolaba koydum hemen tükettik zaten.
Danone,31.03.2020,Pınar,Danone Tikveşli Yoğurtta Kıl Çıktı,Activia çilekli yoğurt yerken kasığıma gelen kıl parçası. Beni oldukça rahatsız etti. Özellikle Danone activia gibi adı bilinen bir markadan bunu hiç beklemiyordum. Mide bulandırıcı ve çok rahatsız edici. Bu konuyla ilgilenilmesini talep ediyorum. Tüketici açısından kötü bir durum.
Danone,14.03.2020,Emre,Danone Tikveşli Activia'nın Gevreğinden Keskin Plastik Parça Çıktı!,"Beylikdüzü Beykent'ten aldığım Activia mix&GO doğal probiyotikli yoğurdun içine üzerinde bulunan buğday gevreğimi döktüm ve yemeye başladım. 3-4 kaşık sonra ağzıma keskin bir şey geldi. 

Sert gevrek zannedip ısırmaya kalktım olmadı, çıkardığımda keskin bir plastik olduğunu gördüm. Bu büyük bir sorun yaratabilirdi. 

Nasıl olur böyle bir hata anlam veremiyorum. Ya diğer ürünlerin içinden de aynı şey çıkar ve birinin boğazını keserse? Çok keskin bir plastik.

 Şikayet etsem nasıl kanıtlayacağımı bilmiyorum, daha önce de başıma gelmedi bu durum. Kasıtlı mı yoksa Fabrika hatası mı bilemiyorum insan her şeyi düşünüyor."
