marka,sikayet_tarihi,sikayet_eden_kullanici,sikayet_baslik,sikayet_metni
Danone,09.03.2020,Nesrin,Danone Tikveşli Kakaolu Çocuk Sütü Bozuk Çıktı!,Tarihi geçmemiş olmasına rağmen Danone marka çocuk sütü bozuk çıktı ve içinden çok tuhaf parçalar çıktı. Migros marketten aldık. Marka yetkililerin bu konu hakkındaki açıklamalarını merak ediyorum. Çocuklarımıza içirmek için aldığımız bir üründe nasıl böyle bir durum yaşanabilir.
Danone,05.03.2020,Betül,Danone Tikveşli Kapağın Darbe Almadan Çıkması,Aldığım salep kapağı darbe almadan çıktı. bu kadar kalitesiz bir malzeme kullanmanız şaşırttı. Ürünlerinizi sürekli tüketen biriyim fakat ürünün yarısını yarın içmek için dolaba yerleştirecektim ama ağzı açık hiç sağlıklı değil. Umarım firma dönüş yapar.
Danone,03.03.2020,Tahir,Danone Tikveşli Activa Probiyotik Shottan Çıkan Nesneler,2 haftadır activa probiyotik shot kullanıyorum. 2 çeşit ürünü karışık aldım. Ürünlerin bazılarından fotoğrafta gözüken şeyler çıkıyor. Böcek benziyor ama ne olduğuna karar veremedim. İçip içmeme konusunda kararsız kalıp döktüm.
Danone,20.02.2020,Umut,Danone Tikveşli 6 Paket Skt Bulunmuyor,Migros'tan aldığımız 6 li Danone pudinglerinde 6 li paketlerin herhangi bir yerinde SKT bulunmuyor ve bu sebeple tarihi geçmiş ürün alıp almadığımızı göremiyoruz. Süt ürünü satan bir firma olarak bunun geliştirilmesi gerektiğini belirtmek isterim.
Danone,22.02.2020,Zeliha,Danone Tikveşli Yarım Çıkan Yoğurtlar!,"Üstü şekerli Danone yoğurt aldık yarısı boş çıktı! Daha önce de yarım çıkmıştı. Sürekli kullandığım bir marka ama çocuklarımıza yediriyoruz bunları daha miktarını ayarlayamıyorsunuz içeriğine nasıl güvenelim? 

En iyisini alıyoruz diye içimiz rahattı siz de böyle yaparsanız diğer ürünlerle fiyat farkınızdan başka bir şey kalmayacak geriye!"
Danone,21.02.2020,Nesrin,Activia Yoğurdun Dibi Sarı Sarı,"Sade olarak almış olduğum toğurdun dibi sarı küf gibi çıkıyor. Bu 2. Defa yazdım dönüş yok. Son kullanma tarihi geçmeden nasıl bölye bir durum oluyor. Zehirlenmekten korkuyorum. Diyet yaptığım için tercih ediyorum ama vazgeçmem gerek sanırım. Destek rica ederim.
Saygılarımla.

"
Danone,20.01.2020,Nagihan,Danone Tikveşli Süt Bozuk,İstanbul Sancaktepe' den aldığım Danone süt bozuk çıktı. İnanılmaz kötü kokuyordu. Süt beyazdan krem rengine dönmüş. Hayatımda böyle bir şey görmedim. Tarihi geçmemişti ama bozulmuş. Çok garip bir durum ilgili kişilerin daha dikkatli olmasını diliyorum.
